text,intent,domain,intent_name,domain_name
what expression would i use to say i love you if i were an italian,84,5,translate,travel
"can you tell me how to say 'i do not speak much spanish' , in spanish",84,5,translate,travel
"what is the equivalent of , 'life is good' in french",84,5,translate,travel
"tell me how to say , 'it is a beautiful morning' in italian",84,5,translate,travel
"if i were mongolian , how would i say that i am a tourist",84,5,translate,travel
how do i say 'hotel' in finnish,84,5,translate,travel
"i need you to translate the sentence , 'we will be there soon' into portuguese",84,5,translate,travel
please tell me how to ask for a taxi in french,84,5,translate,travel
"can you tell me how i would say , 'more bread please' in french",84,5,translate,travel
what is the correct way to say 'i am a visitor' in french,84,5,translate,travel
"how would i say , 'i do n't know the answer' in spanish",84,5,translate,travel
i would like to know the proper way to greet an adult in portuguese,84,5,translate,travel
what words would i use to tell someone i am lost if i were japanese,84,5,translate,travel
how would i say thank you if i were russian,84,5,translate,travel
can you tell me how i would normally say thank you as a french person,84,5,translate,travel
i would like to know how to say hello in french,84,5,translate,travel
if i were english how would i say subway,84,5,translate,travel
i would i say subway if i were english,84,5,translate,travel
how do you say hi in french,84,5,translate,travel
in england how do they say subway,84,5,translate,travel
translate hello in french,84,5,translate,travel
how is hello said in french,84,5,translate,travel
what do you call a subway if you were english,84,5,translate,travel
how would i say if i were english subway,84,5,translate,travel
how should i say hello in french,84,5,translate,travel
how could i say twin in chinese,84,5,translate,travel
how can i say not now in spanish,84,5,translate,travel
what do spanish people say for the word cow,84,5,translate,travel
translate hello to english,84,5,translate,travel
how do you say goodbye in spanish,84,5,translate,travel
how would i say love in french,84,5,translate,travel
could you translate atm machine into english,84,5,translate,travel
please translate grocery into french for me,84,5,translate,travel
how do germans say goodnight,84,5,translate,travel
tell me how the russians say notebook,84,5,translate,travel
how do vietnameses people say hello,84,5,translate,travel
how do i say thank you in japanese,84,5,translate,travel
what is latin for i love you,84,5,translate,travel
how can i thank somebody in italian,84,5,translate,travel
how do i say you 're welcome in chinese,84,5,translate,travel
translate hello english to french,84,5,translate,travel
what is hello in french,84,5,translate,travel
what phrase means goodbye in hawaii,84,5,translate,travel
what spanish word means hello,84,5,translate,travel
translate hello to french,84,5,translate,travel
translate english to french hello,84,5,translate,travel
what is the word for hello spanish,84,5,translate,travel
how do they say goodbye in hawaii,84,5,translate,travel
what 's local slang for goodbye in hawaii,84,5,translate,travel
how do you say hello in french,84,5,translate,travel
tell me how to say hello in spanish,84,5,translate,travel
what do i say for goodbye in hawaii,84,5,translate,travel
translate hello into french for me,84,5,translate,travel
how do i say hello in french,84,5,translate,travel
translate for me hello into french,84,5,translate,travel
how would they say say goodbye in hawaii,84,5,translate,travel
what is spanish for hello,84,5,translate,travel
how would i say hello in french,84,5,translate,travel
how can i say i love you in italy,84,5,translate,travel
what is spanish for good morning,84,5,translate,travel
how do you say it 's snowing in german,84,5,translate,travel
how would you say can i borrow five dollars in portuguese,84,5,translate,travel
do you know how to say where is the restroom in french,84,5,translate,travel
how would i say pleased to meet you if i were japanese,84,5,translate,travel
can you translate hello into swedish for me,84,5,translate,travel
can you translate i love you into french for me,84,5,translate,travel
can you translate where 's the bar into irish for me,84,5,translate,travel
how would i say goodbye if i were norwegian,84,5,translate,travel
how would i say i love you if i were french,84,5,translate,travel
how would i say hello if i were swedish,84,5,translate,travel
can you translate good bye into russian for me,84,5,translate,travel
can you translate i have to go pee into korean for me,84,5,translate,travel
how would i say i'm not guilty if i were mexican,84,5,translate,travel
how do you say thank you in spanish,84,5,translate,travel
how does one say thank you in spanish,84,5,translate,travel
how can i say thank you in spanish,84,5,translate,travel
what is thank you in spanish,84,5,translate,travel
what is the way to say thank you in spanish,84,5,translate,travel
how do they say who is your father in german,84,5,translate,travel
how do they say where 's the bathroom in spanish,84,5,translate,travel
how do they say how 's it going in swahili,84,5,translate,travel
how do they say i love you in japanese,84,5,translate,travel
how do they say what 's up in chinese,84,5,translate,travel
how do you say thank you in german,84,5,translate,travel
how do you say please in arabic,84,5,translate,travel
how do you say cat in spanish,84,5,translate,travel
how do you say i'm hungry in french,84,5,translate,travel
how do you say i need coffee in dutch,84,5,translate,travel
how do they say yes in brazil,84,5,translate,travel
can you translate cat into russian for me,84,5,translate,travel
can you translate bowl into russian for me,84,5,translate,travel
how do they say hello in france,84,5,translate,travel
i wanna know a phrase in spanish,84,5,translate,travel
can you translate bat into russian for me,84,5,translate,travel
how do they say no in germany,84,5,translate,travel
can you translate hi into spanish for me,84,5,translate,travel
i wanna learn a phrase in russian,84,5,translate,travel
how do they say hello in germany,84,5,translate,travel
can you translate milk into spanish for me,84,5,translate,travel
how do they say hello in brazil,84,5,translate,travel
i need 20000 transferred from my savings to my checking,0,0,transfer,banking
complete a transaction from savings to checking of 20000,0,0,transfer,banking
transfer 20000 from my savings account to checking account,0,0,transfer,banking
take 20000 from savings and put it in checking,0,0,transfer,banking
put 20000 into my checking account from my savings account,0,0,transfer,banking
send 100 dollars between bank of the west and bank of america acccounts,0,0,transfer,banking
send 50 dollars between bank of america and chase accounts,0,0,transfer,banking
send 2000 dollars between chase and rabobank accounts,0,0,transfer,banking
send 1200 dollars between usaa and navy federal accounts,0,0,transfer,banking
send 400 dollars between city bank and usaa accounts,0,0,transfer,banking
take 40 and transfer it to account a from b,0,0,transfer,banking
transfer 40 from account a to b,0,0,transfer,banking
move 40 from account b to account a,0,0,transfer,banking
put 40 from account a to b,0,0,transfer,banking
take 40 from account a and transfer it to account b,0,0,transfer,banking
i need to transfer from this account to that one,0,0,transfer,banking
need to transfer from one account to my other one,0,0,transfer,banking
i would like to transfer from one account to my second one,0,0,transfer,banking
i need to transfer from one account to my second one,0,0,transfer,banking
i have to transfer from one account to my other one,0,0,transfer,banking
send fifty dollars from me to carrie,0,0,transfer,banking
transfer sixty dollars to dad from my biggest accnt,0,0,transfer,banking
send over a hundred dollars from huntington into saving,0,0,transfer,banking
move 57 dollars from saving into mom,0,0,transfer,banking
transfer two hundred dollars between my portfolio and my money market account,0,0,transfer,banking
i need to transfer ten dollars from my bank of america account to my capital one account,0,0,transfer,banking
go ahead and send ten dollars from bank of america to capital one,0,0,transfer,banking
i must transfer ten dollars from my bank of america account to my capital one account,0,0,transfer,banking
i got to transfer ten dollars from my bank of america account to my capital one account,0,0,transfer,banking
i want you to send ten dollars from bank of america to capital one,0,0,transfer,banking
i need you to send ten dollars from bank of america to capital one,0,0,transfer,banking
i have to transfer ten dollars from my bank of america account to my capital one account,0,0,transfer,banking
send ten dollars from bank of america to capital one,0,0,transfer,banking
please send ten dollars from bank of america to capital one,0,0,transfer,banking
make a transfer of 200 from my savings account to my checking account,0,0,transfer,banking
please transfer 250 from checking to savings,0,0,transfer,banking
transfer 500 from my checking to my savings,0,0,transfer,banking
please transfer 100 from my checking to my savings account,0,0,transfer,banking
transfer 500 from my money market savings account to my checking account,0,0,transfer,banking
send money from one account to another,0,0,transfer,banking
transfer 200 dollars from paypal to savings,0,0,transfer,banking
transfer 10 from checking to savings,0,0,transfer,banking
send 100 from paypal to my bank,0,0,transfer,banking
please transfer 100 dollars between my amazon payments and savings accounts,0,0,transfer,banking
i would like to make a transfer,0,0,transfer,banking
i want to transfer funds between accounts,0,0,transfer,banking
send over 50 dollars between my shared and not shared accounts,0,0,transfer,banking
whats the quickest way to money from one account to another,0,0,transfer,banking
what is the process to move money from one account to another,0,0,transfer,banking
i need you to send 500 dollars from my high tier account to my regular checking account,0,0,transfer,banking
can you transfer money from a to b,0,0,transfer,banking
send my money between accounts,0,0,transfer,banking
how can i send money from one account to another,0,0,transfer,banking
i need to move money from one account to another,0,0,transfer,banking
send 20 from debit to steve 's account,0,0,transfer,banking
send 20 dollars from savings to checking,0,0,transfer,banking
please transfer my funds,0,0,transfer,banking
please transfer 50 to my checking account from credit,0,0,transfer,banking
go ahead and move 200 from amazon to my bank account,0,0,transfer,banking
help me move my money,0,0,transfer,banking
i need my money to be moved,0,0,transfer,banking
help me move my money please,0,0,transfer,banking
i need to move my money,0,0,transfer,banking
move my money please,0,0,transfer,banking
i would like to transfer 5 from savings to checking,0,0,transfer,banking
transfer 5 from savings to checking,0,0,transfer,banking
can you transfer 5 from savings to checking,0,0,transfer,banking
send 5 from savings to checking,0,0,transfer,banking
please transfer 5 from savings to checking,0,0,transfer,banking
please switch s checking to mortage,0,0,transfer,banking
please transfer s from saving to checking,0,0,transfer,banking
could you transfer x from saving to checking,0,0,transfer,banking
help me transfer x from credit to debit,0,0,transfer,banking
please transfer x from checking to saving,0,0,transfer,banking
transfer money to another account,0,0,transfer,banking
requesting money transfer between accounts,0,0,transfer,banking
transfer money from this account to that account,0,0,transfer,banking
can you transfer money from my account,0,0,transfer,banking
money transfer request,0,0,transfer,banking
send 100 dollars from checking to savings,0,0,transfer,banking
transfer 100 dollars checking to savings,0,0,transfer,banking
transfer 100 dollars between checking and savings,0,0,transfer,banking
take 100 dollars from checking and send it to savings,0,0,transfer,banking
move 100 dollars from checking to savings,0,0,transfer,banking
can we wire some money over to the other account i have,0,0,transfer,banking
time to move some cash from one account to another,0,0,transfer,banking
i need to throw some money into that other account,0,0,transfer,banking
let 's send some money to another account,0,0,transfer,banking
i want to initiate a transfer from one account to the other,0,0,transfer,banking
transfer money from one place to another,0,0,transfer,banking
move money from one account to another,0,0,transfer,banking
transfer between two accounts,0,0,transfer,banking
make a transfer between accounts,0,0,transfer,banking
send money to another account,0,0,transfer,banking
i need ten dollars sent from b of a to washington mutual,0,0,transfer,banking
transfer fifty dollars between my chase and bank of america account,0,0,transfer,banking
deposit ten bucks from my chase account to my ally account,0,0,transfer,banking
put a hundred dollars in my ally account from bluebird,0,0,transfer,banking
i want seventy bucks transferred from b of a to chase,0,0,transfer,banking
can i initiate a one time transfer from my savings account to my money market account,0,0,transfer,banking
please set a 4 minute timer,98,6,timer,utility
please set a timer for 6 minutes,98,6,timer,utility
set a timer for 5 minutes,98,6,timer,utility
i need a 7 minute timer,98,6,timer,utility
i need to set the timer for two minutes,98,6,timer,utility
can you set a timer for me for fifteen minutes starting now,98,6,timer,utility
start the timer now and stop at thirty minutes,98,6,timer,utility
i would like you to set the timer to go off in ten minutes,98,6,timer,utility
please set a timer for 40 minutes,98,6,timer,utility
wake me in an hour,98,6,timer,utility
please set a timer for cookies,98,6,timer,utility
i want a timer set,98,6,timer,utility
remind me in \( x \) hours,98,6,timer,utility
set timer for \( x \) minutes,98,6,timer,utility
i gotta have a 10 minute timer,98,6,timer,utility
please set a timer for me,98,6,timer,utility
i need a 10 minute timer,98,6,timer,utility
i wish to have a 10 minute timer,98,6,timer,utility
i really need to set a timer,98,6,timer,utility
set a new timer for ten seconds,98,6,timer,utility
set a timer for me,98,6,timer,utility
i want a 10 minute timer,98,6,timer,utility
i gotta set a timer,98,6,timer,utility
set a 10 minute timer,98,6,timer,utility
set a brand new timer for eight seconds,98,6,timer,utility
set a ten second timer,98,6,timer,utility
i must set a timer,98,6,timer,utility
set a timer for twelve seconds,98,6,timer,utility
set a timer for fifteen seconds,98,6,timer,utility
tell me when two minutes are up,98,6,timer,utility
start a timer for two minutes,98,6,timer,utility
set a timer for two minutes,98,6,timer,utility
start counting down from two minutes,98,6,timer,utility
can you set a timer for two minutes,98,6,timer,utility
please set 5 minute timer,98,6,timer,utility
can u please set the timer for 5 minutes,98,6,timer,utility
set timer of 5 minutes,98,6,timer,utility
can u set a timer for 5 minutes,98,6,timer,utility
set a one hour timer,98,6,timer,utility
please set a timer for 20 minutes,98,6,timer,utility
set a five minute timer please,98,6,timer,utility
set a timer for two hours,98,6,timer,utility
can you set a two hour timer,98,6,timer,utility
set the timer for me please,98,6,timer,utility
you need to set the timer for me,98,6,timer,utility
i need you to set timer for me,98,6,timer,utility
please set the timer for me,98,6,timer,utility
i would like a timer set,98,6,timer,utility
can you set a timer,98,6,timer,utility
i need you to set a time,98,6,timer,utility
i need a timer set for 15 minutes,98,6,timer,utility
start a countdown for 20 minutes,98,6,timer,utility
set a timer for 15 minutes,98,6,timer,utility
i 'll need you to set a timer for 10 minutes,98,6,timer,utility
let 's get a timer set for 5 minutes,98,6,timer,utility
set a timer for 35 minutes,98,6,timer,utility
please start counting down from 10 minutes,98,6,timer,utility
let 's get a timer going for 10 minutes,98,6,timer,utility
i need a timer for 20 seconds,98,6,timer,utility
timer 5 minutes,98,6,timer,utility
alert me in 20 minutes,98,6,timer,utility
give me a 10 minute countdown,98,6,timer,utility
let me know in 15 minutes please,98,6,timer,utility
"i'm cooking an egg , timer for 3 mins",98,6,timer,utility
10 minute timer,98,6,timer,utility
start a timer for 10 minutes,98,6,timer,utility
timer 10 minutes,98,6,timer,utility
count down 10 minutes,98,6,timer,utility
make up a timer for me,98,6,timer,utility
create a timer for me,98,6,timer,utility
can you set a timer for me,98,6,timer,utility
i need to set a timer,98,6,timer,utility
set up a timer,98,6,timer,utility
could you start a timer for me,98,6,timer,utility
lets set a timer for me,98,6,timer,utility
please run a timer for me,98,6,timer,utility
set a one minute timer,98,6,timer,utility
set a five minute timer,98,6,timer,utility
set a seven minute timer,98,6,timer,utility
start a timer for me,98,6,timer,utility
set a four minute timer,98,6,timer,utility
set a six minute timer,98,6,timer,utility
how do i set a timer,98,6,timer,utility
i want a timer for 5 minutes,98,6,timer,utility
timer for 5 minutes,98,6,timer,utility
set a timer to go off in 5 minutes,98,6,timer,utility
set timer for 5 minutes,98,6,timer,utility
i want to set a timer,98,6,timer,utility
make a timer for 5 minutes,98,6,timer,utility
please set a timer for,98,6,timer,utility
remind me that time is up in sixty minutes,98,6,timer,utility
set an alarm for nine minutes from now,98,6,timer,utility
tell me when ninety minutes have passed,98,6,timer,utility
please set timer for 4 pm,98,6,timer,utility
want 5 minute timer,98,6,timer,utility
set 30 minute timer,98,6,timer,utility
get a 3 minute timer,98,6,timer,utility
"please , can you set the timer for me",98,6,timer,utility
can you please the timer,98,6,timer,utility
will you set the timer,98,6,timer,utility
what is the meaning of realism,104,6,definition,utility
what is regard mean,104,6,definition,utility
what is the meaning of interorganizational,104,6,definition,utility
what is it is all relative mean,104,6,definition,utility
what is intercontinental mean,104,6,definition,utility
what is the meaning of supercede,104,6,definition,utility
what is let it be mean,104,6,definition,utility
what is the definition of incomprehensible,104,6,definition,utility
what is the meaning of stupendous,104,6,definition,utility
what is the definition of intelligent,104,6,definition,utility
what is good riddance mean,104,6,definition,utility
what is break a leg mean,104,6,definition,utility
what is the meaning of hyperactive,104,6,definition,utility
what is the definition of valor,104,6,definition,utility
what is stupedous meant,104,6,definition,utility
find the meaning of qat,104,6,definition,utility
what the heck is qat,104,6,definition,utility
define qat for me,104,6,definition,utility
read me a definition for qat,104,6,definition,utility
look up qat please,104,6,definition,utility
what might the meaning of altruism be,104,6,definition,utility
exactly what does altruism mean,104,6,definition,utility
what does altruism mean,104,6,definition,utility
what is the definition of altruism,104,6,definition,utility
what is the meaning of altruism,104,6,definition,utility
affiliate 's definition is what,104,6,definition,utility
the definition of affiliate is,104,6,definition,utility
what 's the meaning of affiliate,104,6,definition,utility
what 's affiliate definition,104,6,definition,utility
definition of affiliate is what,104,6,definition,utility
whats the definition of poor,104,6,definition,utility
describe the meaning of dog,104,6,definition,utility
what does money mean,104,6,definition,utility
tell me what the word die means,104,6,definition,utility
what is the definition of succumb,104,6,definition,utility
what is the meaning of telepathy,104,6,definition,utility
what does tertiary mean,104,6,definition,utility
tell me the definition of the word redemption,104,6,definition,utility
what is the meaning of the word lux,104,6,definition,utility
what is an ataraxy,104,6,definition,utility
what does the word ataraxy mean,104,6,definition,utility
what does ataraxy mean,104,6,definition,utility
use the word ataraxy in a sentence,104,6,definition,utility
define ataraxy,104,6,definition,utility
what does discretionary mean,104,6,definition,utility
define discretionary,104,6,definition,utility
i want to know the definition of discretionary,104,6,definition,utility
can you give the definition of deiscretionary,104,6,definition,utility
let 's hear the definition of iridium,104,6,definition,utility
what 's the definition of analogy,104,6,definition,utility
can you tell me the definition of sucrose,104,6,definition,utility
definition of anachronism,104,6,definition,utility
what 's the definition of patriarchy,104,6,definition,utility
can you tell me the definition of yttrbium,104,6,definition,utility
please share the definition of episcopalian,104,6,definition,utility
what does saffron mean,104,6,definition,utility
define sonogram,104,6,definition,utility
define thoroughbred,104,6,definition,utility
what 's the meaning of a fortnight,104,6,definition,utility
what is an anachronism,104,6,definition,utility
what 's the meaning of emulsify,104,6,definition,utility
tell me what cyst means,104,6,definition,utility
what is the definition of flange,104,6,definition,utility
tell me what flange means,104,6,definition,utility
define flange,104,6,definition,utility
flange means what,104,6,definition,utility
what is the meaning of flange,104,6,definition,utility
what does rescind mean,104,6,definition,utility
what is the meaning of word rescind,104,6,definition,utility
is rescind a word of positive connotation,104,6,definition,utility
where i can use word rescind,104,6,definition,utility
read me the definition of ajar,104,6,definition,utility
what does ajar mean,104,6,definition,utility
can you show me the dictionary definition of ajar,104,6,definition,utility
tell me what monstrosity means,104,6,definition,utility
give me the definition of ajar,104,6,definition,utility
what is the definition of didactic,104,6,definition,utility
i need to know what adumbrate means can you look it up for me now,104,6,definition,utility
i want to know what the word discomfit means,104,6,definition,utility
find what the word diaphanous mean please,104,6,definition,utility
do you know what calumny means please look it up for me,104,6,definition,utility
find out what the word abrogate means for me,104,6,definition,utility
tell me what edict means,104,6,definition,utility
what does the word abjure mean,104,6,definition,utility
can you tell me what dirge means,104,6,definition,utility
tell me what the word arboreal means,104,6,definition,utility
whats the definition of transmute,104,6,definition,utility
what is the meaning of the word slander,104,6,definition,utility
what is meant by defense,104,6,definition,utility
tell me what the word bounty means,104,6,definition,utility
what does deceive mean,104,6,definition,utility
define zesty,104,6,definition,utility
look up zesty in dictionary,104,6,definition,utility
definition of zesty,104,6,definition,utility
what is the definition of zesty,104,6,definition,utility
what does zesty mean,104,6,definition,utility
tell me what alternative means,104,6,definition,utility
what does alternative mean,104,6,definition,utility
give me the meaning of alternative,104,6,definition,utility
tell me the meaning of alternative,104,6,definition,utility
does life have meaning,132,8,meaning_of_life,small_talk
is being alive the meaning of life,132,8,meaning_of_life,small_talk
what is the real meaning of life,132,8,meaning_of_life,small_talk
what is the answer to the meaning of life,132,8,meaning_of_life,small_talk
is there really an answer to the meaning of life,132,8,meaning_of_life,small_talk
does life have a meaning,132,8,meaning_of_life,small_talk
who can tell me if there 's any meaning to life,132,8,meaning_of_life,small_talk
what makes life have any meaning,132,8,meaning_of_life,small_talk
why do you think we 're here,132,8,meaning_of_life,small_talk
what 's the answer to existence,132,8,meaning_of_life,small_talk
what 's the point of sentience,132,8,meaning_of_life,small_talk
what 's the purpose of existence,132,8,meaning_of_life,small_talk
what 's the purpose of life,132,8,meaning_of_life,small_talk
what 's the point of this dumpster fire known as life,132,8,meaning_of_life,small_talk
what is life 's meaning,132,8,meaning_of_life,small_talk
is there a greater purpose in life,132,8,meaning_of_life,small_talk
what is our purpose in life,132,8,meaning_of_life,small_talk
how is life in existence,132,8,meaning_of_life,small_talk
what 's lifes meaning,132,8,meaning_of_life,small_talk
what exactly is the meaning of life,132,8,meaning_of_life,small_talk
whats lifes meaning exactly,132,8,meaning_of_life,small_talk
what 's the meaning of this life,132,8,meaning_of_life,small_talk
what is the meaning of life here,132,8,meaning_of_life,small_talk
does my life have meaning,132,8,meaning_of_life,small_talk
i wish to know the meaning of life,132,8,meaning_of_life,small_talk
i wanna know the meaning of life,132,8,meaning_of_life,small_talk
i wanna know the point of life,132,8,meaning_of_life,small_talk
i need to know the point of life,132,8,meaning_of_life,small_talk
i must know the point of life,132,8,meaning_of_life,small_talk
tell the meaning of life,132,8,meaning_of_life,small_talk
i gotta know the meaning of life,132,8,meaning_of_life,small_talk
what is your take on the meaning of life,132,8,meaning_of_life,small_talk
tell me what is the purpose of life,132,8,meaning_of_life,small_talk
