text,intent,domain,intent_name,domain_name
can you calculate my tax,107,7,taxes,work
how much is my income tax,107,7,taxes,work
can you tell me my income tax,107,7,taxes,work
how much do i pay in income tax,107,7,taxes,work
how much tax do i owe,107,7,taxes,work
what kind of tax do i pay,107,7,taxes,work
what amount am i taxed on my income,107,7,taxes,work
what do you think will be the result of my federal tax return,107,7,taxes,work
what 's the damage on my federal tax return,107,7,taxes,work
what does my federal tax return look like,107,7,taxes,work
what will my federal tax return be,107,7,taxes,work
how much money will i get or owe on my federal tax return,107,7,taxes,work
how much money do i pay in taxes,107,7,taxes,work
"how much money do i pay in taxes , please",107,7,taxes,work
"what amount of money do i pay in taxes , please",107,7,taxes,work
how much do i pay in taxes,107,7,taxes,work
"how much do i pay in taxes , please",107,7,taxes,work
i need to know how much i should pay in tax,107,7,taxes,work
let me know my tax rate,107,7,taxes,work
what amount of tax should i pay,107,7,taxes,work
please tell me what i pay in taxes,107,7,taxes,work
i would like to know how much i pay in taxes,107,7,taxes,work
what is the total amount i pay in taxes,107,7,taxes,work
can you tell me how much i pay in taxes,107,7,taxes,work
how much does it seem my state taxes will be,107,7,taxes,work
tell me what my state taxes are,107,7,taxes,work
what are my state taxes looking like,107,7,taxes,work
can you tell me more about my federal taxes,107,7,taxes,work
what do i owe in federal taxes,107,7,taxes,work
give me the specifics on my federal taxes,107,7,taxes,work
what does it look like my state taxes will add up to,107,7,taxes,work
i need the details on my federal taxes,107,7,taxes,work
what do i currently pay in taxes,107,7,taxes,work
what do i pay in taxes,107,7,taxes,work
how much will i pay for state taxes this year,107,7,taxes,work
how different will my state taxes be,107,7,taxes,work
what is my state taxes currently,107,7,taxes,work
what will my state taxes amount to this year,107,7,taxes,work
how much did my state taxes change,107,7,taxes,work
how much tax do i pay,107,7,taxes,work
how much do i pay in tax,107,7,taxes,work
how much do i pay in my taxes,107,7,taxes,work
how much as my taxes by the way,107,7,taxes,work
what amount do my state taxes look like,107,7,taxes,work
what 's the minimum i owe on the car payment,9,0,min_payment,banking
what 's the least amount i need to pay on the electric bill,9,0,min_payment,banking
what 's the smallest amount i can pay on the water bill,9,0,min_payment,banking
what 's the minimum amount for my electric bill,9,0,min_payment,banking
what 's the least i can pay on the medical payments for february,9,0,min_payment,banking
how much can i get away with paying for my college loan,9,0,min_payment,banking
what 's the minimum required payment on my visa card,9,0,min_payment,banking
i want to know my bill 's minimum payment,9,0,min_payment,banking
what is my bill 's minimum payment,9,0,min_payment,banking
minimum payment of my bill please,9,0,min_payment,banking
can you tell me the minimum payment of my bill,9,0,min_payment,banking
tell me the minimum payment of my bill,9,0,min_payment,banking
the minumum to pay is what,9,0,min_payment,banking
what is the minimum i can pay for my electric bill,9,0,min_payment,banking
please lookup the minimum i need to pay on my credit card,9,0,min_payment,banking
what is the minimum i need to pay for my cell phone bill,9,0,min_payment,banking
tell me what my minimum payment is,9,0,min_payment,banking
what is the minimum i have to pay on my chase card,9,0,min_payment,banking
what is the minimum i can pay for my telephone bill,9,0,min_payment,banking
what is the minimum i can pay for my light bill,9,0,min_payment,banking
what is the minimum i can pay for the gas bill,9,0,min_payment,banking
what do i have to pay on my amex that is the minimum,9,0,min_payment,banking
i need to know my cable bill minimum payment,9,0,min_payment,banking
please tell me the minimum i can pay on my electric bill,9,0,min_payment,banking
please tell me the minimum i can pay on my water bill,9,0,min_payment,banking
what is the lowest amount i can pay for my electric bill,9,0,min_payment,banking
tell me the lowest amount i can pay for my cable bill,9,0,min_payment,banking
let me know the minimum i can pay on my cable bill,9,0,min_payment,banking
please tell me the bill 's minimum payment,9,0,min_payment,banking
what is the lowest amount i can pay for my cable bill,9,0,min_payment,banking
tell me the minimum i can pay on my cable bill,9,0,min_payment,banking
i need to know the bill 's minimum payment,9,0,min_payment,banking
tell me my electric bill minimum payment,9,0,min_payment,banking
tell me the bill 's minimum payment,9,0,min_payment,banking
what is my cable bill minimum payment,9,0,min_payment,banking
i would like to know the bill 's minimum payment,9,0,min_payment,banking
i must know my water bill minimum payment,9,0,min_payment,banking
i wanna know the bill 's minimum payment,9,0,min_payment,banking
inform me the lowest amount i can pay for my cable bill,9,0,min_payment,banking
i want you to tell me the minimum i can pay on my rent bill,9,0,min_payment,banking
i would like to know my water bill minimum payment,9,0,min_payment,banking
let me know the lowest amount i can pay for my cable bill,9,0,min_payment,banking
find the minimum due on my peco energy bill for february,9,0,min_payment,banking
what is the minimum payment on my chase mastercard,9,0,min_payment,banking
please give me the minimum payment total for my sprint phone bill,9,0,min_payment,banking
can you tell me the minimum amount due on my visa this month,9,0,min_payment,banking
i want to know the bill 's minimum payment,9,0,min_payment,banking
please inform me of the minimum payment of the bill,9,0,min_payment,banking
"the bill 's minimum payment , what is it",9,0,min_payment,banking
what is the minimum amount of money required as payment for the bill,9,0,min_payment,banking
what is the minimum payment for the bill,9,0,min_payment,banking
i need to pay the smallest amount on my phone bill,9,0,min_payment,banking
how little can i pay on my car bill,9,0,min_payment,banking
what is the smallest i can pay on the water bill,9,0,min_payment,banking
how tiny a payment can i make on electric bill,9,0,min_payment,banking
how much do i have to at least pay on my medical bills,9,0,min_payment,banking
how small of a payment can i make for my chase card bill,9,0,min_payment,banking
what is the minimum payment i can make on my xcel energy bill,9,0,min_payment,banking
please tell me the minimum amount i can pay on my wells fargo credit card,9,0,min_payment,banking
what is the smallest amount i can pay on my tmobile bill,9,0,min_payment,banking
what is the smallest payment i can make toward my xfinity bill,9,0,min_payment,banking
can you tell me my cards minimum payment,9,0,min_payment,banking
minimum payment for my credit card,9,0,min_payment,banking
can i get the minimum payment for my credit card,9,0,min_payment,banking
i would like to know the minimum payment for my credit card,9,0,min_payment,banking
i need to know my cards minimum payment,9,0,min_payment,banking
could you tell me the minimum payment on my mortgage,9,0,min_payment,banking
what is the minimum payment on my eddie bauer card,9,0,min_payment,banking
i need to know what the minimum payment is on my electric bill,9,0,min_payment,banking
what is the bare minimum for my truck payment,9,0,min_payment,banking
how much is the minimum payment on my chase card,9,0,min_payment,banking
what is the least amount i can pay for power bill,9,0,min_payment,banking
how much is the minimum payment for power bill,9,0,min_payment,banking
what is the minimum payment for my credit card bill,9,0,min_payment,banking
how much is the least i can pay for power bill,9,0,min_payment,banking
what is the minimum payment for my power bill,9,0,min_payment,banking
how low can i reduce my phone bill before paying,9,0,min_payment,banking
how low can we get my phone bill,9,0,min_payment,banking
what is the minimum payment on my phone bill,9,0,min_payment,banking
what is the lowest i can pay on my phone bill,9,0,min_payment,banking
what is the minimum i can pay for my phone bill,9,0,min_payment,banking
how little can i pay for my water bill,9,0,min_payment,banking
show my my minimum payment for youtube,9,0,min_payment,banking
what 's the minimum payment for my internet bill,9,0,min_payment,banking
what 's the minimum payment on my credit card bill,9,0,min_payment,banking
what 's the minimum payment on my phone bill,9,0,min_payment,banking
what is the minimum payment i can make on my electric bill,9,0,min_payment,banking
what 's the minimum payment on my gas bill,9,0,min_payment,banking
what 's the least payment i can make on my cable bill,9,0,min_payment,banking
what is the minimum required payment for my cell phone bill,9,0,min_payment,banking
what 's the minimum i can pay on my sewer bill,9,0,min_payment,banking
tell me minimum to pay on landscape bill,9,0,min_payment,banking
show me the minimum payment for my boat bill,9,0,min_payment,banking
minimum to pay on power bill,9,0,min_payment,banking
what 's the minimum payment for our cc bill,9,0,min_payment,banking
pay the minimum payment for m and t bill,9,0,min_payment,banking
tell me my minimum citicard payment,9,0,min_payment,banking
how much is the minimum payment due for my citicard this month,9,0,min_payment,banking
can you tell me my minimum due for citicard,9,0,min_payment,banking
what is the minimum for my citicard this month,9,0,min_payment,banking
change to whisper mode,140,9,whisper_mode,meta
change mode to whisper,140,9,whisper_mode,meta
whisper mode off,140,9,whisper_mode,meta
change out of whisper mode,140,9,whisper_mode,meta
turn off whisper mode,140,9,whisper_mode,meta
activate whisper mode,140,9,whisper_mode,meta
whisper mode activate,140,9,whisper_mode,meta
can you please lower the volume please,140,9,whisper_mode,meta
use your indoor voice please,140,9,whisper_mode,meta
whisper for me,140,9,whisper_mode,meta
is it possible for you to whisper for me,140,9,whisper_mode,meta
turn on your whisper mode,140,9,whisper_mode,meta
i'm going to need you to be quiet now please,140,9,whisper_mode,meta
do n't make too much noise,140,9,whisper_mode,meta
go into whisper mode now please,140,9,whisper_mode,meta
can you use the whisper voice,140,9,whisper_mode,meta
volume to whisper voice,140,9,whisper_mode,meta
turn on the whisper voice,140,9,whisper_mode,meta
go to the whisper voice,140,9,whisper_mode,meta
can you whisper until i tell you not to,140,9,whisper_mode,meta
switch to your whispering voice please,140,9,whisper_mode,meta
whisper from here on out please,140,9,whisper_mode,meta
whisper from now on,140,9,whisper_mode,meta
i need you to use your whisper voice,140,9,whisper_mode,meta
do not talk so loudly,140,9,whisper_mode,meta
use your quiet voice,140,9,whisper_mode,meta
you need to speak softer,140,9,whisper_mode,meta
speak quiet as though you were in a church,140,9,whisper_mode,meta
change to normal vocals mode,140,9,whisper_mode,meta
turn your volume up,140,9,whisper_mode,meta
turn up your volume,140,9,whisper_mode,meta
switch to quiet mode,140,9,whisper_mode,meta
let 's start whispering,140,9,whisper_mode,meta
let 's switch to whisper voice,140,9,whisper_mode,meta
let 's use whisper voice,140,9,whisper_mode,meta
i decide to switch out of whisper mode,140,9,whisper_mode,meta
i want to switch out of whisper mode,140,9,whisper_mode,meta
can you whisper,140,9,whisper_mode,meta
let 's switch out of whisper mode,140,9,whisper_mode,meta
let 's whisper,140,9,whisper_mode,meta
go to whisper mode,140,9,whisper_mode,meta
can you switch out of whisper mode,140,9,whisper_mode,meta
i think we should whisper,140,9,whisper_mode,meta
shh please speak with a whisper,140,9,whisper_mode,meta
please turn on whisper mode,140,9,whisper_mode,meta
go into whisper mode now,140,9,whisper_mode,meta
i need you to go into whisper mode,140,9,whisper_mode,meta
please only use a whisper when speaking,140,9,whisper_mode,meta
i ca n't be loud and need you to speak more quietly,140,9,whisper_mode,meta
"go back to whisper mode , please",140,9,whisper_mode,meta
"change to whisper mode , please",140,9,whisper_mode,meta
"switch to whisper mode , please",140,9,whisper_mode,meta
go back to whisper mode,140,9,whisper_mode,meta
please switch to whisper,140,9,whisper_mode,meta
switch to the whisper mode,140,9,whisper_mode,meta
switch over to whisper,140,9,whisper_mode,meta
switch to whisper please,140,9,whisper_mode,meta
i want whisper mode to be switched off,140,9,whisper_mode,meta
i want you to use whisper voice now,140,9,whisper_mode,meta
please turn on whisper voice,140,9,whisper_mode,meta
i dont need whisper mode on any more,140,9,whisper_mode,meta
could you please get out of whisper mode,140,9,whisper_mode,meta
i need your setting switched to whisper mode right away,140,9,whisper_mode,meta
please shut off whisper mode for now,140,9,whisper_mode,meta
make sure to set yourself to whisper mode before i go to the movie,140,9,whisper_mode,meta
please turn on whisper mode because i am about to be in class,140,9,whisper_mode,meta
i want your setting adjusted to whisper voice now,140,9,whisper_mode,meta
please switch to whisper mode for now,140,9,whisper_mode,meta
please begin using the whisper voice setting,140,9,whisper_mode,meta
i want you to be in whisper mode now because i am in the library,140,9,whisper_mode,meta
can you change to the whisper voice setting,140,9,whisper_mode,meta
please speak with the whisper voice,140,9,whisper_mode,meta
exit out of whisper mode,140,9,whisper_mode,meta
is it possible for you to use the whisper voice,140,9,whisper_mode,meta
switch to whisper mode,140,9,whisper_mode,meta
i 'd like you to use the whisper voice,140,9,whisper_mode,meta
immediately begin using whisper mode,140,9,whisper_mode,meta
"i ca n't hear you , stop whispering !",140,9,whisper_mode,meta
start using whisper mode,140,9,whisper_mode,meta
stop using the whisper mode,140,9,whisper_mode,meta
engage whisper mode now,140,9,whisper_mode,meta
can you go to the whisper voice,140,9,whisper_mode,meta
go back to normal mode please,140,9,whisper_mode,meta
use the whisper voice,140,9,whisper_mode,meta
use your whispering voice,140,9,whisper_mode,meta
6 inch voices please,140,9,whisper_mode,meta
can you switch to whisper mode,140,9,whisper_mode,meta
i want whisper mode,140,9,whisper_mode,meta
please switch to whisper mode,140,9,whisper_mode,meta
would you mind switching to whisper mode,140,9,whisper_mode,meta
could you please switch to whisper mode,140,9,whisper_mode,meta
"if you do n't mind , please switch to whisper mode",140,9,whisper_mode,meta
i need you to switch to whisper mode,140,9,whisper_mode,meta
i want you to switch to whisper mode,140,9,whisper_mode,meta
talk in whisper voice,140,9,whisper_mode,meta
please whisper,140,9,whisper_mode,meta
please use whisper,140,9,whisper_mode,meta
please talk quietly,140,9,whisper_mode,meta
use whisper voice,140,9,whisper_mode,meta
turn to whisper mode,140,9,whisper_mode,meta
"please cancel what you are doing , i 've changed my mind",137,9,cancel,meta
"never mind , cancel that",137,9,cancel,meta
"stop working on it , i need something else",137,9,cancel,meta
"cancel my last request , i know the answer",137,9,cancel,meta
"forget it , i do not need it anymore",137,9,cancel,meta
pause,137,9,cancel,meta
cancel that last thing,137,9,cancel,meta
silence,137,9,cancel,meta
quit,137,9,cancel,meta
mute,137,9,cancel,meta
stop,137,9,cancel,meta
stop and go back,137,9,cancel,meta
ai stop talking,137,9,cancel,meta
quiet now,137,9,cancel,meta
shhhh,137,9,cancel,meta
how do i make you stop talking,137,9,cancel,meta
can you be quiet please,137,9,cancel,meta
please stop doing what i asked,137,9,cancel,meta
please be quiet,137,9,cancel,meta
i would like you to stop what you were doing,137,9,cancel,meta
please cancel that last command,137,9,cancel,meta
can you cancel what you were doing,137,9,cancel,meta
can you cancel,137,9,cancel,meta
shut up !,137,9,cancel,meta
i need you to stop talking now,137,9,cancel,meta
i want you to quit the action,137,9,cancel,meta
discontinue please,137,9,cancel,meta
i do n't want you to speak any more for now,137,9,cancel,meta
discontinue your current task,137,9,cancel,meta
abort please,137,9,cancel,meta
quit the current action please,137,9,cancel,meta
forget my previous command,137,9,cancel,meta
abort the current action,137,9,cancel,meta
actually forget that i do n't need it,137,9,cancel,meta
quit what you are doing,137,9,cancel,meta
"sorry , you can actually stop that",137,9,cancel,meta
"i actually do n't want this anymore , please abort",137,9,cancel,meta
please cancel your present task,137,9,cancel,meta
"that 's enough , do n't say anymore please",137,9,cancel,meta
i want you to stop your present action,137,9,cancel,meta
stop talking please,137,9,cancel,meta
"what you are doing is not actually helpful , please cancel the action",137,9,cancel,meta
please stop,137,9,cancel,meta
cancel action,137,9,cancel,meta
please cancel the input,137,9,cancel,meta
"ai , stop talking",137,9,cancel,meta
"ai , shut up",137,9,cancel,meta
"ai , stop !",137,9,cancel,meta
please be quiet now,137,9,cancel,meta
terminate,137,9,cancel,meta
negate last command,137,9,cancel,meta
halt,137,9,cancel,meta
would you stop talking please,137,9,cancel,meta
please abandon the current job,137,9,cancel,meta
please abort the current task,137,9,cancel,meta
terminate current process,137,9,cancel,meta
i want you to cancel the current action,137,9,cancel,meta
abort,137,9,cancel,meta
please stop doing that,137,9,cancel,meta
abort running program,137,9,cancel,meta
do n't continue with what you 're doing,137,9,cancel,meta
oh shut the hell up would you,137,9,cancel,meta
destroy process,137,9,cancel,meta
please cancel that last task,137,9,cancel,meta
please refrain from carrying out the current task,137,9,cancel,meta
"ai , cancel that last request",137,9,cancel,meta
do not complete the task that i gave you,137,9,cancel,meta
"ai , please stop your current task",137,9,cancel,meta
"actually , cancel that command",137,9,cancel,meta
"nevermind , cancel that",137,9,cancel,meta
"actually , cancel that",137,9,cancel,meta
forget it,137,9,cancel,meta
cancel that,137,9,cancel,meta
do n't do this process,137,9,cancel,meta
undo,137,9,cancel,meta
cancel current process,137,9,cancel,meta
undo this process,137,9,cancel,meta
just shut up,137,9,cancel,meta
stop that,137,9,cancel,meta
cancel that input,137,9,cancel,meta
"never mind , do n't do that",137,9,cancel,meta
never mind,137,9,cancel,meta
stop doing that,137,9,cancel,meta
halt that immediately,137,9,cancel,meta
stop the process happening now,137,9,cancel,meta
"stop , i changed my mind",137,9,cancel,meta
cancel that last command,137,9,cancel,meta
oops cancel that,137,9,cancel,meta
can you stop,137,9,cancel,meta
could you stop talking for a second,137,9,cancel,meta
could you stop please,137,9,cancel,meta
can you switch off,137,9,cancel,meta
can you stop speaking,137,9,cancel,meta
can you please cancel,137,9,cancel,meta
can you end the task,137,9,cancel,meta
scratch,137,9,cancel,meta
refrain from talking,137,9,cancel,meta
halt the process,137,9,cancel,meta
no more talking,137,9,cancel,meta
i advise you to quit talking,137,9,cancel,meta
"to visit cambodia , do i need an international visa",86,5,international_visa,travel
do i need to get a visa to visit canada,86,5,international_visa,travel
will i need a visa to visit ireland,86,5,international_visa,travel
will i need a travel visa to go to canary islands,86,5,international_visa,travel
i want to visit portugal do i need a travel visa,86,5,international_visa,travel
i want to see paris will i need an international visa,86,5,international_visa,travel
"for travel to argentina , do i need to get a travel visa",86,5,international_visa,travel
will i have to apply for a visa if i want to visit mexico,86,5,international_visa,travel
to vacation to tel aviv do i need a travel visa,86,5,international_visa,travel
do i need to obtain a travel visa to go on vacation to places in eastern europe,86,5,international_visa,travel
would i need a tourist visa for brazil,86,5,international_visa,travel
do i need a tourist visa for europe,86,5,international_visa,travel
i want to know if i shouldget a tourist visa for italy,86,5,international_visa,travel
is it necessary to apply for a tourist visa for mexico,86,5,international_visa,travel
should i get a travel visa for spain,86,5,international_visa,travel
does moscow require travel visas to visit,86,5,international_visa,travel
would i need a travel visa to go to the congo,86,5,international_visa,travel
do i need an international visa to go to south korea,86,5,international_visa,travel
do i need an international visa to go to tibet,86,5,international_visa,travel
do i need an international visa to go to vietnam,86,5,international_visa,travel
do i need an international visa to go to hong kong,86,5,international_visa,travel
do i need an international visa to go to malaysia,86,5,international_visa,travel
i am going to travel to mexico soon do i need to get a visa,86,5,international_visa,travel
i need to know if i must have an international visa to go to france,86,5,international_visa,travel
i'm going to jamaica next week am i needing a visa,86,5,international_visa,travel
tell me whether i need an international visa to go to mexico,86,5,international_visa,travel
i'm going to mexico do i need an international via,86,5,international_visa,travel
let me know if i need an international visa to go to sudan,86,5,international_visa,travel
am i in need of an international visa to go to france,86,5,international_visa,travel
do i need to get a visa for traveling to chile,86,5,international_visa,travel
do i need a visa to travel to jamaica,86,5,international_visa,travel
i need to know if i need a visa to travel to el salvador,86,5,international_visa,travel
would i need a visa if i want to travel to mexico,86,5,international_visa,travel
do i need a visa to travel to mexico,86,5,international_visa,travel
does mexico require me to have a visa to travel there,86,5,international_visa,travel
is a visa needed to go to mexico,86,5,international_visa,travel
if i want to travel to mexico do i need to get a visa,86,5,international_visa,travel
do i need a visa to scotland,86,5,international_visa,travel
do i need a visa to russia,86,5,international_visa,travel
do i need a visa for canada,86,5,international_visa,travel
do i need a travel visa to visit germany,86,5,international_visa,travel
i am going to russia and am wondering if i need a visa,86,5,international_visa,travel
do i need a travel visa to visit russia,86,5,international_visa,travel
do i need a travel visa to visit canada,86,5,international_visa,travel
i am going to germany soon do i need a visa,86,5,international_visa,travel
do i need a travel visa to visit japan,86,5,international_visa,travel
do i need to get a visa for russia,86,5,international_visa,travel
do i need a visa to go to greece,86,5,international_visa,travel
do i need a travel visa to visit china,86,5,international_visa,travel
do i need a visa for germany,86,5,international_visa,travel
do i need a visa to go to somewhere internationally,86,5,international_visa,travel
do i need a visa to spain,86,5,international_visa,travel
do i need an international visa to go to mexico,86,5,international_visa,travel
do i need an international visa to go to england,86,5,international_visa,travel
do i need an international visa to go to brazil,86,5,international_visa,travel
do i need an international visa to go to canada,86,5,international_visa,travel
do i need an international visa to go to spain,86,5,international_visa,travel
should i get a visa before going to cancun,86,5,international_visa,travel
is a visa required to visit cancun,86,5,international_visa,travel
will i need a visa to travel to cancun,86,5,international_visa,travel
do i need a visa to go to cancun,86,5,international_visa,travel
do i need a visa to travel to canada,86,5,international_visa,travel
does mexico travel require a visa,86,5,international_visa,travel
would i need to get a visa to go to ireland,86,5,international_visa,travel
"if i'm planning to go to the uk , do i need a visa",86,5,international_visa,travel
might i need to get a visa to travel to venezuela,86,5,international_visa,travel
"i'm going to be going to canada soon , do they require a visa for entry",86,5,international_visa,travel
do i need a visa to get into canada later this year,86,5,international_visa,travel
does travelling to that place require a visa,86,5,international_visa,travel
do i need a visa to go there,86,5,international_visa,travel
do i need a visa to leave the country,86,5,international_visa,travel
does international travel always require a visa,86,5,international_visa,travel
when does travelling require a visa,86,5,international_visa,travel
if i go to canada next month do i need a visa,86,5,international_visa,travel
do i need to bring a visa when i go to canada next month,86,5,international_visa,travel
"i'm going to canada soon , do i need a visa",86,5,international_visa,travel
what paperwork will i need to visit northern ireland,86,5,international_visa,travel
should i get a visa for crete,86,5,international_visa,travel
will i need a visa to go to moldova,86,5,international_visa,travel
does laos require a travel visa,86,5,international_visa,travel
do i need to apply for a visa to visit dnipro,86,5,international_visa,travel
israel has strict restrictions do i need a visa to travel there,86,5,international_visa,travel
visa 's are hard to get do i need one when i travel to israel,86,5,international_visa,travel
i'm vacationing in israel will i need a visa,86,5,international_visa,travel
