text,intent,domain,intent_name,domain_name
how much money have i dropped recently,14,0,spending_history,banking
how much money have i spent this month,14,0,spending_history,banking
what 's the amount of money i spent yesterday,14,0,spending_history,banking
could you tell me how much i 've spent over the past two weeks,14,0,spending_history,banking
how much money have i spent this week,14,0,spending_history,banking
could you tell me how much money i spent last week,14,0,spending_history,banking
please tell me how much i have spent recently,14,0,spending_history,banking
how much did i spend last week,14,0,spending_history,banking
can you tell me my spending history from last week,14,0,spending_history,banking
i want to know how much i spent last week,14,0,spending_history,banking
i want to know my recent spending,14,0,spending_history,banking
how much have i paid for rent in the last 6 months,14,0,spending_history,banking
how much money have i spent on groceries recently,14,0,spending_history,banking
how much did i spend on groceries today,14,0,spending_history,banking
how much have i spent eating out this week,14,0,spending_history,banking
what chunk of my income have i spent on rent this year,14,0,spending_history,banking
what 's it been costing me to buy three packs a day,14,0,spending_history,banking
what have car repairs ran me this month,14,0,spending_history,banking
what has gas cost me this week,14,0,spending_history,banking
what did car insurance run me this year,14,0,spending_history,banking
what 's the total amount i 've spent eating out in the last two weeks,14,0,spending_history,banking
how much have i spent on alcohol recently,14,0,spending_history,banking
how much have i spent on books recently,14,0,spending_history,banking
how much have i spent on food recently,14,0,spending_history,banking
how much have i spent on bills recently,14,0,spending_history,banking
how much have i spent on clothes recently,14,0,spending_history,banking
i need to know my total spending on amazon for november and december 2018,14,0,spending_history,banking
please list my total spending on grocery shopping for the last two months,14,0,spending_history,banking
how much have i spent on starbucks since the beginning of 2019,14,0,spending_history,banking
what is my total spent on dining out for the month of january,14,0,spending_history,banking
what is the total amount that i have spent on the cash app for this month so far,14,0,spending_history,banking
have i spent a lot on food recently,14,0,spending_history,banking
i need to know what i have spent on food recently,14,0,spending_history,banking
can you tell me what i have spent on food recently,14,0,spending_history,banking
what have i spent on food recently,14,0,spending_history,banking
what is the amount i have spent on food recently,14,0,spending_history,banking
how much have i lately spent on eating out,14,0,spending_history,banking
what have i spent lately in child care,14,0,spending_history,banking
how much have i spent lately on food,14,0,spending_history,banking
how much money have i recently spent on entertainment,14,0,spending_history,banking
how much have i paid in medical expenses recently,14,0,spending_history,banking
how much did i spend on gas last week,14,0,spending_history,banking
can you tell me what i spend on gas for the past two weeks,14,0,spending_history,banking
yesterday what did i spend on lunch,14,0,spending_history,banking
i need to know what i spend on utilities for the last year,14,0,spending_history,banking
what did i spend on groceries this month,14,0,spending_history,banking
have i been giving lot of money to food to food lately,14,0,spending_history,banking
how much money did i use to spend on catering five hours ago,14,0,spending_history,banking
how much did i spend on gear two weeks ago,14,0,spending_history,banking
have i been spending a lot on roast beef lately,14,0,spending_history,banking
have i been spending a ton of money on movies lately,14,0,spending_history,banking
how much money did i spend on tent equipment four hours ago,14,0,spending_history,banking
how much did i spend on furniture last week,14,0,spending_history,banking
how much did i spend on petrol 2 days ago,14,0,spending_history,banking
how much money did i spend on food last month,14,0,spending_history,banking
would please let me know how much i spent on food in january,14,0,spending_history,banking
could you check my account and let me know how much i spent on food in january,14,0,spending_history,banking
please check and tell me the amount i spent on food last month,14,0,spending_history,banking
let me know the amount i spent on food last month,14,0,spending_history,banking
i have been spending a lot on food out lately,14,0,spending_history,banking
i have spent a lot on groceries lately,14,0,spending_history,banking
i spent a lot on vacations recently,14,0,spending_history,banking
i have been spending a lot on utility bills lately,14,0,spending_history,banking
i have been spending a lot on insurance lately,14,0,spending_history,banking
did i go out to eat more than usual,14,0,spending_history,banking
have i been spending more money at restaurants,14,0,spending_history,banking
how much did i spend on food,14,0,spending_history,banking
how much do i spend going out to eat,14,0,spending_history,banking
what 's my going out to eat tab this month vs last month,14,0,spending_history,banking
how much did i spend shopping for clothes today,14,0,spending_history,banking
how much did i spend the past 3 days,14,0,spending_history,banking
how much did i spend on gas the past month,14,0,spending_history,banking
how much have i spent on food in the past week,14,0,spending_history,banking
have they approved my vacation request yet,111,7,pto_request_status,work
give me the status of my vacation request,111,7,pto_request_status,work
am i going to be able to get my vacation request,111,7,pto_request_status,work
i want to check on my vacation request,111,7,pto_request_status,work
is my vacation approved yet,111,7,pto_request_status,work
"my vacation , has it been approved yet",111,7,pto_request_status,work
have i been approved for vacation yet,111,7,pto_request_status,work
am i approved for vacation yet,111,7,pto_request_status,work
did they approve my day off request,111,7,pto_request_status,work
is my day off approved,111,7,pto_request_status,work
did they say yes to my day off request,111,7,pto_request_status,work
did i get my day off,111,7,pto_request_status,work
is my day off request approved,111,7,pto_request_status,work
update on vacation request,111,7,pto_request_status,work
what is the current status of my vacation request,111,7,pto_request_status,work
i need status on that vacation request,111,7,pto_request_status,work
how is my vacation request looking,111,7,pto_request_status,work
please inform me on my current vacation request status,111,7,pto_request_status,work
have they recieved my vacation request and approved it,111,7,pto_request_status,work
will my vacation be approved soon,111,7,pto_request_status,work
did my vacation get approved,111,7,pto_request_status,work
do we have good news in the form of vacation approval,111,7,pto_request_status,work
has my vacation request been acknowledged,111,7,pto_request_status,work
has my request for vacation days been signed by my supervisor yet,111,7,pto_request_status,work
has my supervisor approved my vacation,111,7,pto_request_status,work
has may supervisor approved the vacation days i asked for,111,7,pto_request_status,work
"on my vacation request , what is the latest information",111,7,pto_request_status,work
what is the news on my vacation request,111,7,pto_request_status,work
what is the update on my vacation request,111,7,pto_request_status,work
what is the most recent info for my request for vacation,111,7,pto_request_status,work
what is the status for what i requested for my vacation,111,7,pto_request_status,work
tell me about my vacation request,111,7,pto_request_status,work
update me on my vacation request,111,7,pto_request_status,work
what about my vacation request,111,7,pto_request_status,work
has the status of my vacation request changed,111,7,pto_request_status,work
has my vacation request been updated,111,7,pto_request_status,work
has my vacation time been signed off on,111,7,pto_request_status,work
what 's my vacation status,111,7,pto_request_status,work
has my vacation been approved,111,7,pto_request_status,work
has my vacation been ok 'd,111,7,pto_request_status,work
will i be allowed to take vacation,111,7,pto_request_status,work
are they going to let me take vacation,111,7,pto_request_status,work
has my request for vacation time been okayed,111,7,pto_request_status,work
has my vacation time at work been allowed,111,7,pto_request_status,work
is walmart going to let me take the vacation time i asked for,111,7,pto_request_status,work
i'm i okayed for vacation time,111,7,pto_request_status,work
did you get confirmation my vacation is a go,111,7,pto_request_status,work
is the request for vacation i filed with my manager at intel approved yet,111,7,pto_request_status,work
do you know if my vacation request went through,111,7,pto_request_status,work
has my manager at mcdonald 's confirmed i can take vacation,111,7,pto_request_status,work
have they authorized my vacation,111,7,pto_request_status,work
i want to know if my vacation request has been approved,111,7,pto_request_status,work
"the status of my day off request , please",111,7,pto_request_status,work
do you know if my vacation request has been approved,111,7,pto_request_status,work
has my vacation request been approved,111,7,pto_request_status,work
what is the status of my vacation request,111,7,pto_request_status,work
any news for me regarding my day off request,111,7,pto_request_status,work
i want to know the status of my day off request,111,7,pto_request_status,work
tell me the status of my vacation request,111,7,pto_request_status,work
tell me the status of my day off request,111,7,pto_request_status,work
could you tell me the status of my vacation request,111,7,pto_request_status,work
i requested some vacation time has it been approved,111,7,pto_request_status,work
can you share the status of my day off request,111,7,pto_request_status,work
was my day off request approved,111,7,pto_request_status,work
status of my request for vacation,111,7,pto_request_status,work
what 's my day off request 's status,111,7,pto_request_status,work
has my day off request been approved or denied yet,111,7,pto_request_status,work
has my vacation request been denied or approved yet,111,7,pto_request_status,work
has my request for the day off been approved yet,111,7,pto_request_status,work
how is the approval of my day off progressing,111,7,pto_request_status,work
how is the approval of my day off going,111,7,pto_request_status,work
whats going on with my day off request,111,7,pto_request_status,work
any status update on my day off request,111,7,pto_request_status,work
did you hear back about my day off request,111,7,pto_request_status,work
is my day off request still pending,111,7,pto_request_status,work
has anyone looked over my request for a day off,111,7,pto_request_status,work
has anyone approved my day off request,111,7,pto_request_status,work
how 's my day off request looking,111,7,pto_request_status,work
has my day off request been looked at yet,111,7,pto_request_status,work
i need you to let me know what the status of my day off request is,111,7,pto_request_status,work
please let me know what the status of my day off request is,111,7,pto_request_status,work
could you tell me what the status of my day off request is,111,7,pto_request_status,work
would you tell me what the status of my day of request is,111,7,pto_request_status,work
i need to know the status of my day off request,111,7,pto_request_status,work
has my vacation request been approved yet,111,7,pto_request_status,work
has my vacation been approved yet,111,7,pto_request_status,work
has my time off request been approved yet,111,7,pto_request_status,work
check on the status of my vacation request please,111,7,pto_request_status,work
please check to see if my vacation request has been updated,111,7,pto_request_status,work
please find out the status of my vacation request,111,7,pto_request_status,work
do you know if my vacation was approved yet or not,111,7,pto_request_status,work
please tell me if my vacation has been approved or not,111,7,pto_request_status,work
can you look into the status of my vacation request,111,7,pto_request_status,work
i want to know what the latest is on my vacation request i submitted,111,7,pto_request_status,work
i need to know if my vacation was approved,111,7,pto_request_status,work
please check to see if my vacation has been approved,111,7,pto_request_status,work
do you know if my vacation request is still pending,111,7,pto_request_status,work
can you find out if my vacation time off request has been approved or not,111,7,pto_request_status,work
i sent in a request for vacation time off and am wondering if its been approved yet,111,7,pto_request_status,work
"i have n't heard if my request for time off for vacation has been approved , can you get an update for me",111,7,pto_request_status,work
how do i look up my credit score,15,1,credit_score,credit_card
please look up my credit score,15,1,credit_score,credit_card
can you figure out how to find my credit score,15,1,credit_score,credit_card
are you able to lookup my credit rating,15,1,credit_score,credit_card
how can i find my credit rating,15,1,credit_score,credit_card
where can i check my credit rating,15,1,credit_score,credit_card
say my credit score,15,1,credit_score,credit_card
give me my credit score,15,1,credit_score,credit_card
i want my credit score,15,1,credit_score,credit_card
inform me of my credit score,15,1,credit_score,credit_card
clue me in on my credit score,15,1,credit_score,credit_card
provide me with my credit score,15,1,credit_score,credit_card
my credit score is,15,1,credit_score,credit_card
i need my credit score,15,1,credit_score,credit_card
find my credit score for me,15,1,credit_score,credit_card
what is my credit score,15,1,credit_score,credit_card
please get my credit score,15,1,credit_score,credit_card
can you find my credit score,15,1,credit_score,credit_card
i 'd like to know what my credit rating is,15,1,credit_score,credit_card
please tell me my credit rating,15,1,credit_score,credit_card
what in the world is my credit rating,15,1,credit_score,credit_card
my credit score is what,15,1,credit_score,credit_card
tell me my credit score please,15,1,credit_score,credit_card
can you tell me my credit score,15,1,credit_score,credit_card
find my credit score and tell it to me,15,1,credit_score,credit_card
get my credit score,15,1,credit_score,credit_card
what is my exact credit score,15,1,credit_score,credit_card
how good is my credit score,15,1,credit_score,credit_card
what 's my credit score rating,15,1,credit_score,credit_card
what kind of credit score do i have,15,1,credit_score,credit_card
"if i want my credit score , how do i find it",15,1,credit_score,credit_card
how do i find information about my credit score,15,1,credit_score,credit_card
what is the process of finding my credit score,15,1,credit_score,credit_card
how do i get my credit score,15,1,credit_score,credit_card
how do i locate my current credit score,15,1,credit_score,credit_card
where is my credit score,15,1,credit_score,credit_card
how do i see my credit score,15,1,credit_score,credit_card
how exactly do i find my credit score,15,1,credit_score,credit_card
how do i locate my credit score,15,1,credit_score,credit_card
how do i find out what my credit score is,15,1,credit_score,credit_card
i really wanna know my credit score,15,1,credit_score,credit_card
i wish to know my credit rating,15,1,credit_score,credit_card
let me understand my credit rating,15,1,credit_score,credit_card
i wanna know my credit rating now,15,1,credit_score,credit_card
i gotta know my credit score,15,1,credit_score,credit_card
tell me my credit rating,15,1,credit_score,credit_card
i would love to know my credit score,15,1,credit_score,credit_card
i wish to know my credit score,15,1,credit_score,credit_card
i wanna know my credit score,15,1,credit_score,credit_card
tell me what my credit rating is,15,1,credit_score,credit_card
can you provide me my credit score,15,1,credit_score,credit_card
i 'd like the number for my credit score,15,1,credit_score,credit_card
tell me my credit score,15,1,credit_score,credit_card
verify with me my credit score,15,1,credit_score,credit_card
can you help me find my credit score,15,1,credit_score,credit_card
would you tell me my credit score,15,1,credit_score,credit_card
how do i find my credit score,15,1,credit_score,credit_card
will you tell me my credit score,15,1,credit_score,credit_card
do you know my credit score,15,1,credit_score,credit_card
how to see my credit score,15,1,credit_score,credit_card
can i see my credit score,15,1,credit_score,credit_card
hows my credit score,15,1,credit_score,credit_card
websites that share credit ratings,15,1,credit_score,credit_card
what 's my credit rating,15,1,credit_score,credit_card
how do i find out my credit rating,15,1,credit_score,credit_card
how to locate my credit score,15,1,credit_score,credit_card
where is my credit score located,15,1,credit_score,credit_card
where can i find my credit score,15,1,credit_score,credit_card
find my credit score,15,1,credit_score,credit_card
tell me the steps to getting my credit score,15,1,credit_score,credit_card
help me locate my credit score,15,1,credit_score,credit_card
lets look up my credit score,15,1,credit_score,credit_card
i would like to look up my credit score please,15,1,credit_score,credit_card
i want to find out what my credit score is,15,1,credit_score,credit_card
help me find my credit score,15,1,credit_score,credit_card
what is my fica score,15,1,credit_score,credit_card
can you reveal my credit score,15,1,credit_score,credit_card
how is my credit score rated,15,1,credit_score,credit_card
any idea what my credit score is,15,1,credit_score,credit_card
show me my credit score please,15,1,credit_score,credit_card
let me know what my credit score is,15,1,credit_score,credit_card
is my credit score high,15,1,credit_score,credit_card
i am trying to find my credit score,15,1,credit_score,credit_card
show me my credit score,15,1,credit_score,credit_card
how does my credit score look,15,1,credit_score,credit_card
is my credit report low,15,1,credit_score,credit_card
whats my credit rating,15,1,credit_score,credit_card
what is my current credit score,15,1,credit_score,credit_card
where can i check my credit score,15,1,credit_score,credit_card
where can i see my credit score,15,1,credit_score,credit_card
how can i find out my credit score,15,1,credit_score,credit_card
inform me of my current credit rating,15,1,credit_score,credit_card
please notify me of my credit rating,15,1,credit_score,credit_card
i would like to be told about my credit rating,15,1,credit_score,credit_card
can you tell me about my credit rating,15,1,credit_score,credit_card
tell me my current credit rating,15,1,credit_score,credit_card
what is the number of my credit score,15,1,credit_score,credit_card
what 's my credit score,15,1,credit_score,credit_card
let me know my credit score,15,1,credit_score,credit_card
how is my credit score,15,1,credit_score,credit_card
how can i apply for a discover card,19,1,new_card,credit_card
can i apply for a discover card,19,1,new_card,credit_card
how do applications for discover cards work,19,1,new_card,credit_card
is this how i apply for a discover card,19,1,new_card,credit_card
what does it take to get a new card,19,1,new_card,credit_card
how do i sign up for a new credit card,19,1,new_card,credit_card
can i complete an application for a new credit card,19,1,new_card,credit_card
is it possible to get a new credit card,19,1,new_card,credit_card
please show me how to apply for a visa card,19,1,new_card,credit_card
i need to apply for a visa card,19,1,new_card,credit_card
i need to know how to apply for a visa card,19,1,new_card,credit_card
tell me how to apply for a visa card,19,1,new_card,credit_card
what is the process to apply for a visa card,19,1,new_card,credit_card
show me how to apply for a visa card,19,1,new_card,credit_card
can you let me know the info on how to apply for a visa card,19,1,new_card,credit_card
"visa card , i want to apply",19,1,new_card,credit_card
show me the application for a visa card,19,1,new_card,credit_card
how do i get a new credit card sent to me,19,1,new_card,credit_card
can you send me a new credit card please mine is getting old and unusable,19,1,new_card,credit_card
can you apply for idaho independent card for me,19,1,new_card,credit_card
please apply cc visa card for me,19,1,new_card,credit_card
apply for a kbc card for me,19,1,new_card,credit_card
i want to apply for a alphabank card,19,1,new_card,credit_card
i would like to apply for a bank of america travel rewards credit card,19,1,new_card,credit_card
i need to apply for a new credit card,19,1,new_card,credit_card
i wanna apply for a new credit card,19,1,new_card,credit_card
i got to apply for a new credit card,19,1,new_card,credit_card
i wanna apply for a bank of america travel rewards credit card,19,1,new_card,credit_card
i need to apply for a bank of america travel rewards credit card,19,1,new_card,credit_card
i desire to apply for a bank of america travel rewards credit card,19,1,new_card,credit_card
apply for a bank of america travel rewards credit card,19,1,new_card,credit_card
i must apply for a new credit card,19,1,new_card,credit_card
i gotta apply for a new credit card,19,1,new_card,credit_card
i would like to apply for a master card,19,1,new_card,credit_card
i would like to apply for a green card,19,1,new_card,credit_card
i would like to apply for a visa card,19,1,new_card,credit_card
i would like to apply for a credit card,19,1,new_card,credit_card
i would like to apply for a discover card,19,1,new_card,credit_card
what 's the procedure to apply for a new credit card,19,1,new_card,credit_card
how can i get a new credit card,19,1,new_card,credit_card
direct me to the application for a new credit card,19,1,new_card,credit_card
apply for an american express card,19,1,new_card,credit_card
can you tell me if i might be able to apply for a new credit card,19,1,new_card,credit_card
might i be able to apply for a new credit card,19,1,new_card,credit_card
can you help me apply for a visa card,19,1,new_card,credit_card
i want to apply for a discover card,19,1,new_card,credit_card
am i eligible for a new credit card application,19,1,new_card,credit_card
is it possible to apply for a new credit card,19,1,new_card,credit_card
i think i 'd like to apply for an amex,19,1,new_card,credit_card
am i able to apply for a new credit card,19,1,new_card,credit_card
application for a mastercard,19,1,new_card,credit_card
can i get a new card,19,1,new_card,credit_card
i would like to apply for a new card,19,1,new_card,credit_card
can i maybe apply for a new card,19,1,new_card,credit_card
can i please get a new card,19,1,new_card,credit_card
can i get a brand new card please,19,1,new_card,credit_card
list the steps for applying for an american express card,19,1,new_card,credit_card
what 's the process for getting an american express card,19,1,new_card,credit_card
what do i need to do to get an american express card,19,1,new_card,credit_card
help me get an american express card,19,1,new_card,credit_card
help me apply for an american express card,19,1,new_card,credit_card
i am hoping to apply for an amex card,19,1,new_card,credit_card
i want to find a new credit card to sign up for,19,1,new_card,credit_card
how do i apply for a barclay 's card,19,1,new_card,credit_card
walk me through the process of applying for an american express card,19,1,new_card,credit_card
i need help figuring out a new credit card to get,19,1,new_card,credit_card
i am interested in applying for a visa card,19,1,new_card,credit_card
i am interested in acquiring a new credit card,19,1,new_card,credit_card
i want to apply for a mastercard,19,1,new_card,credit_card
walk me through applying for a visa card,19,1,new_card,credit_card
i want to submit an application for a barclay 's card,19,1,new_card,credit_card
can you help me sign up for a new credit card,19,1,new_card,credit_card
i need to know how to apply for a mastercard,19,1,new_card,credit_card
i intend to apply for an american express card,19,1,new_card,credit_card
tell me how to apply for an american express card,19,1,new_card,credit_card
i feel like it is time for me to sign up for a new credit card,19,1,new_card,credit_card
how to apply for platinum card,19,1,new_card,credit_card
"i would like to apply for a air canada card visa , can you help me",19,1,new_card,credit_card
please help me apply for a silver card,19,1,new_card,credit_card
tell me the process of applying for a apollo card,19,1,new_card,credit_card
can you tell me how to apply for a western card,19,1,new_card,credit_card
how can i apply for a visa card,19,1,new_card,credit_card
"how can i apply for a visa card , please",19,1,new_card,credit_card
"how do i apply for a visa card , please",19,1,new_card,credit_card
"how can i apply for a mastercard , please",19,1,new_card,credit_card
what if you need to obtain a new credit card,19,1,new_card,credit_card
what if you want to obtain a new credit card,19,1,new_card,credit_card
what if you want a new credit card,19,1,new_card,credit_card
what if you need to get a new credit card,19,1,new_card,credit_card
show me how i can get a new credit card,19,1,new_card,credit_card
can you help me find out how to get a new credit card,19,1,new_card,credit_card
how do i get a new credit card,19,1,new_card,credit_card
can you help me get a new credit card,19,1,new_card,credit_card
